index,title,star_url,journal_raw,journal,year,reference,status,journal_link,journal_link_text,hepdata_link,arxiv_id,arxiv_abs_link,inspire_id,fetch_error
377,Observation of the Onset of Constituent Quark Number Scaling in Heavy-Ion Collisions at RHIC,https://drupal.star.bnl.gov/STAR/publications/Observation-Onset-Constituent-Quark-Number-Scaling-Heavy-Ion-Collisions-RHIC,PRL 2025,PRL,2025,Phys. Rev. Lett. 135 (2025) 72301,published,https://doi.org/10.1103/2qhx-cp79,Phys. Rev. Lett. server,https://www.hepdata.net/record/ins2907591,2504.02531,http://arxiv.org/abs/2504.02531,,
374,Search for the chiral magnetic effect through beam energy dependence of charge separation using event shape selection,https://drupal.star.bnl.gov/STAR/publications/Search-chiral-magnetic-effect-through-beam-energy-dependence-charge-separation-using-ev,PRC 2026,PRC,2026,Phys. Rev. C 113 (2026) 14912,published,https://doi.org/10.1103/pj7s-9ym7,Phys. Rev. C server,https://www.hepdata.net/record/ins2928164,2506.00278,http://arxiv.org/abs/2506.00278,,
368,Precision Measurement of (Net-)proton Number Fluctuations in Au+Au Collisions at RHIC,https://drupal.star.bnl.gov/STAR/publications/Precision-Measurement-Net-proton-Number-Fluctuations-AuAu-Collisions-RHIC,PRL 2025,PRL,2025,Phys. Rev. Lett. 135 (2025) 142301,published,https://doi.org/10.1103/9l69-2d7p,Phys. Rev. Lett. server,https://www.hepdata.net/record/ins2906592,2504.00817,http://arxiv.org/abs/2504.00817,,
362,Light Nuclei Femtoscopy and Baryon Interactions in 3 GeV Au+Au Collisions at RHIC,https://drupal.star.bnl.gov/STAR/publications/Light-Nuclei-Femtoscopy-and-Baryon-Interactions-3-GeV-AuAu-Collisions-RHIC,PLB 2024,PLB,2024,Phys. Lett. B 864 (2025) 139412,published,https://doi.org/10.1016/j.physletb.2025.139412,Phys. Lett. B server,https://www.hepdata.net/record/ins2908949,2410.03436,http://arxiv.org/abs/2410.03436,,
360,Temperature Measurement of Quark-Gluon Plasma at Different Stages,https://drupal.star.bnl.gov/STAR/publications/Temperature-Measurement-Quark-Gluon-Plasma-Different-Stages,Nature Comm. 2025,Nature Comm.,2025,NCOMMS 16 (2025) 9098,published,https://doi.org/10.1038/s41467-025-63216-5,NCOMMS server,https://www.hepdata.net/record/ins2755369,2402.01998,http://arxiv.org/abs/2402.01998,,
356,Measurement of directed flow in Au+Au collisions at sqrt{s_{NN}}= 19.6 and 27 GeV with the STAR Event Plane Detector,https://drupal.star.bnl.gov/STAR/publications/Measurement-directed-flow-AuAu-collisions-sqrtsNN-196-and-27-GeV-STAR-Event-Plane-Detec,PRC 2025,PRC,2025,Phys. Rev. C 111 (2025) 14906,published,https://doi.org/10.1103/PhysRevC.111.014906,Phys. Rev. C server,https://www.hepdata.net/record/ins2808515,2406.18213,http://arxiv.org/abs/2406.18213,,
353,Strangeness Production in sqrt{s_NN} = 3 GeV Au+Au Collisions at RHIC,https://drupal.star.bnl.gov/STAR/publications/Strangeness-Production-sqrtsNN-3-GeV-AuAu-Collisions-RHIC,JHEP 2024,JHEP,2024,JHEP 2024 (2024) 139,published,https://doi.org/10.1007/JHEP10(2024)139,JHEP server,https://www.hepdata.net/record/ins2807679,2407.10110,http://arxiv.org/abs/2407.10110,,
352,Production of Protons and Light Nuclei in Au+Au Collisions at sqrt{s_NN} = 3 GeV with the STAR Detector,https://drupal.star.bnl.gov/STAR/publications/Production-Protons-and-Light-Nuclei-AuAu-Collisions-sqrtsNN-3-GeV-STAR-Detector,PRC 2024,PRC,2024,Phys. Rev. C 110 (2024) 54911,published,https://doi.org/10.1103/PhysRevC.110.054911,Phys. Rev. C server,https://www.hepdata.net/record/ins2724476,2311.11020,http://arxiv.org/abs/2311.11020,,
350,Reaction plane correlated triangular flow in Au+Au collisions at sqrt{s_NN} = 3 GeV,https://drupal.star.bnl.gov/STAR/publications/Reaction-plane-correlated-triangular-flow-AuAu-collisions-sqrtsNN-3-GeV,PRC 2024,PRC,2024,Phys. Rev. C 109 (2024) 44914,published,https://journals.aps.org/prc/abstract/10.1103/PhysRevC.109.044914,Phys. Rev. C server,https://www.hepdata.net/record/ins2702151,2309.12610,http://arxiv.org/abs/2309.12610,,
345,Event-by-event correlations between Lambda (anti-Lambda) hyperon global polarization and handedness with charged hadron azimuthal separation in Au+Au collisions at sqrt(sNN) = 27 GeV from STAR,https://drupal.star.bnl.gov/STAR/publications/Event-event-correlations-between-Lambda-anti-Lambda-hyperon-global-polarization-and-han,PRC 2023,PRC,2023,Phys. Rev. C 108 (2023) 14909,published,https://doi.org/10.1103/PhysRevC.108.014909,Phys. Rev. C server,https://www.hepdata.net/record/ins2652850,2304.10037,http://arxiv.org/abs/2304.10037,,
344,Elliptic Flow of Heavy-Flavor Decay Electrons in Au+Au Collisions at sqrt(sNN) = 27 and 54.4 GeV at RHIC,https://drupal.star.bnl.gov/STAR/publications/Elliptic-Flow-Heavy-Flavor-Decay-Electrons-AuAu-Collisions-sqrtsNN-27-and-544-GeV-RHIC,PLB 2023,PLB,2023,Phys. Lett. B 844 (2023) 138071,published,https://doi.org/10.1016/j.physletb.2023.138071,Phys. Lett. B server,https://www.hepdata.net/record/ins2638989,2303.03546,http://arxiv.org/abs/2303.03546,,
342,Collision-energy Dependence of Deuteron Cumulants and Proton-deuteron Correlations in Au+Au collisions at RHIC,https://drupal.star.bnl.gov/STAR/publications/Collision-energy-Dependence-Deuteron-Cumulants-and-Proton-deuteron-Correlations-AuAu-co,PLB 2024,PLB,2024,Phys. Lett. B 855 (2024) 138560,published,https://doi.org/10.1016/j.physletb.2024.138560,Phys. Lett. B server,https://www.hepdata.net/record/ins2653327,2304.10993,http://arxiv.org/abs/2304.10993,,
340,Global polarization of Λ and Λ ̄ hyperons in Au+Au collisions at √sNN = 19.6 and 27 GeV,https://drupal.star.bnl.gov/STAR/publications/Global-polarization-Lambda-and-Lambdabar-hyperons-AuAu-collisions-sqrtsNN-196-and-27-Ge,PRC 2023,PRC,2023,Phys. Rev. C 108 (2023) 14910,published,https://doi.org/10.1103/PhysRevC.108.014910,Phys. Rev. C server,https://www.hepdata.net/record/ins2659670,2305.08705,http://arxiv.org/abs/2305.08705,,
337,Observation of the electromagnetic field effect via charge-dependent directed flow in heavy-ion collisions at the Relativistic Heavy Ion Collider,https://drupal.star.bnl.gov/STAR/publications/Observation-electromagnetic-field-effect-charge-dependent-directed-flow-heavy-ion-colli,PRX 2024,PRX,2024,PRX 14 (2024) 11028,published,https://journals.aps.org/prx/abstract/10.1103/PhysRevX.14.011028,PRX server,https://www.hepdata.net/record/ins2649979,2304.03430,http://arxiv.org/abs/2304.03430,,
,Electric charge and strangeness-dependent directed flow splitting of produced quarks in Au+Au collisions,https://drupal.star.bnl.gov/STAR/publications/Electric-charge-and-strangeness-dependent-directed-flow-splitting-produced-quarks-AuAu-,PLB 2025,PLB,2025,Phys. Lett. B 862 (2025) 139245,published,https://doi.org/10.1016/j.physletb.2025.139245,Phys. Lett. B server,https://www.hepdata.net/record/ins2649581,2304.02831,http://arxiv.org/abs/2304.02831,,
336,Energy Dependence of Intermittency for Charged Hadrons in Au+Au Collisions at RHIC,https://drupal.star.bnl.gov/STAR/publications/Energy-Dependence-Intermittency-Charged-Hadrons-AuAu-Collisions-RHIC,PLB 2023,PLB,2023,Phys. Lett. B 845 (2023) 138165,published,https://www.sciencedirect.com/science/article/pii/S0370269323004999,Phys. Lett. B server,https://www.hepdata.net/record/ins2626682,2301.11062,http://arxiv.org/abs/2301.11062,,
334,First Observation of Directed Flow of Hypernuclei H3L and H4L in √sNN=3 GeV Au+Au Collisions at RHIC,https://drupal.star.bnl.gov/STAR/publications/First-Observation-Directed-Flow-Hypernuclei-H3L-and-H4L-sqrtsNN-3-GeV-AuAu-Collisions-0,PRL 2023,PRL,2023,Phys. Rev. Lett. 130 (2023) 212301,published,https://journals.aps.org/prl/abstract/10.1103/PhysRevLett.130.212301,Phys. Rev. Lett. server,https://www.hepdata.net/record/ins2605845 ,2211.16981,http://arxiv.org/abs/2211.16981,,
331,"K0 production in Au+Au collisions at sqrt{sNN} = 7.7, 11.5, 14.5, 19.6, 27 and 39 GeV from RHIC beam energy scan",https://drupal.star.bnl.gov/STAR/publications/K0-production-AuAu-collisions-sqrtsNN-77-115-145-196-27-and-39-GeV-RHIC-beam-energy-sca,PRC 2023,PRC,2023,Phys. Rev. C 107 (2023) 34907,published,https://link.aps.org/doi/10.1103/PhysRevC.107.034907,Phys. Rev. C server,https://www.hepdata.net/record/ins2642282 ,2210.02909,http://arxiv.org/abs/2210.02909,,
330,Beam Energy Dependence of Triton Production and Yield Ratio (NtNp/N2d) in Au+Au Collisions at RHIC,https://drupal.star.bnl.gov/STAR/publications/Beam-Energy-Dependence-Triton-Production-and-Yield-Ratio-NtNpN2d-AuAu-Collisions-RHIC,PRL 2023,PRL,2023,Phys. Rev. Lett. 130 (2023) 202301,published,https://doi.org/10.1103/PhysRevLett.130.202301,Phys. Rev. Lett. server,https://www.hepdata.net/record/ins2152917 ,2209.08058,http://arxiv.org/abs/2209.08058,,
327,Measurement of H4L and He4L binding energy in Au+Au collisions at √sNN = 3GeV,https://drupal.star.bnl.gov/STAR/publications/Measurement-H4L-and-He4L-binding-energy-AuAu-collisions-sqrtsNN-3GeV,PLB 2022,PLB,2022,Phys. Lett. B 834 (2022) 137449,published,https://doi.org/10.1016/j.physletb.2022.137449,Phys. Lett. B server,https://www.hepdata.net/record/ins2105274,,http://arxiv.org/abs/2207.00778 ,,
326,Beam Energy Dependence of Fifth and Sixth-Order Net-proton Number Fluctuations in Au+Au Collisions at RHIC,https://drupal.star.bnl.gov/STAR/publications/Beam-Energy-Dependence-Fifth-and-Sixth-Order-Net-proton-Number-Fluctuations-AuAu-Collis,PRL 2023,PRL,2023,Phys. Rev. Lett. 130 (2023) 82301,published,https://doi.org/10.1103/PhysRevLett.130.082301,Phys. Rev. Lett. server,https://www.hepdata.net/record/ins2119969,2207.09837,http://arxiv.org/abs/2207.09837,,
325,Azimuthal anisotropy measurement of (multi)strange hadrons in Au+Au collisions at sqrt(s_NN) = 54.4 GeV,https://drupal.star.bnl.gov/STAR/publications/Azimuthal-anisotropy-measurement-multistrange-hadrons-AuAu-collisions-sqrtsNN-544-GeV,PRC 2023,PRC,2023,Phys. Rev. C 107 (2023) 24912,published,https://doi.org/10.1103/PhysRevC.107.024912,Phys. Rev. C server,https://www.hepdata.net/record/ins2635688,2205.11073,http://arxiv.org/abs/2205.11073,,
321,Measurements of H3L and H4L Lifetimes and Yields in Au+Au Collisions in the High Baryon Density Region,https://drupal.star.bnl.gov/STAR/publications/measurements-h3l-and-h4l-lifetimes-and-yields-auau-collisions-high-baryon-density-regio,PRL 2022,PRL,2022,Phys. Rev. Lett. 128 (2022) 202301,published,https://doi.org/10.1103/PhysRevLett.128.202301,Phys. Rev. Lett. server,https://www.hepdata.net/record/ins1946124,2110.09513,http://arxiv.org/abs/2110.09513,,
320,Higher-order cumulants and correlation functions of proton multiplicity distributions in $\sqrt{s_{NN}}$ = 3 GeV Au+Au collisions at the RHIC STAR experiment,https://drupal.star.bnl.gov/STAR/publications/Higher-Order-Cumulants-and-Correlation-Functions-Proton-Multiplicity-Distributions-sqrt,PRC 2023,PRC,2023,Phys. Rev. C 107 (2023) 24908,published,https://doi.org/10.1103/PhysRevC.107.024908,Phys. Rev. C server,https://www.hepdata.net/record/ins2631860,2209.11940,http://arxiv.org/abs/2209.11940,,
319,Measurements of Proton High Order Cumulants in sqrt{s_NN} = 3 GeV Au+Au Collisions and Implications for the QCD Critical Point,https://drupal.star.bnl.gov/STAR/publications/Measurements-Proton-High-Order-Cumulants-sqrtsNN-3-GeV-AuAu-Collisions-and-Implications,PRL 2022,PRL,2022,Phys. Rev. Lett. 128 (2022) 202303,published,https://doi.org/10.1103/PhysRevLett.128.202303,Phys. Rev. Lett. server,https://www.hepdata.net/record/ins1981670,2112.00240,http://arxiv.org/abs/2112.00240,,
316,Light Nuclei Collectivity from sqrt{s_NN} = 3 GeV Au+Au Collisions at RHIC,https://drupal.star.bnl.gov/STAR/publications/Light-Nuclei-Collectivity-3-GeV-AuAu-Collisions-RHIC,PLB 2022,PLB,2022,Phys. Lett. B 827 (2022) 136941,published,https://doi.org/10.1016/j.physletb.2022.136941,Phys. Lett. B server,https://www.hepdata.net/record/ins1986611,2112.04066,http://arxiv.org/abs/2112.04066,,
315,Beam energy dependence of the linear and mode-coupled flow harmonics in Au+Au collisions,https://drupal.star.bnl.gov/STAR/publications/Beam-energy-dependence-linear-and-mode-coupled-flow-harmonics-AuAu-collisions,PLB 2023,PLB,2023,Phys. Lett. B 839 (2023) 137755,published,https://doi.org/10.1016/j.physletb.2023.137755,Phys. Lett. B server,https://www.hepdata.net/record/ins2634985,2211.11637,http://arxiv.org/abs/2211.11637,,
314,Global Lambda-hyperon polarization in Au+Au collisions at sqrt{sNN} =3 GeV,https://drupal.star.bnl.gov/STAR/publications/global-lambda-hyperon-polarization-auau-collisions-sqrtsnn-3-gev,PRC-L 2021,PRC-L,2021,Phys. Rev. C 104 (2021) 61901,published,https://doi.org/10.1103/PhysRevC.104.L061901,Phys. Rev. C server,https://www.hepdata.net/record/ins1897216,2108.00044,http://arxiv.org/abs/2108.00044,,
311,Disappearance of partonic collectivity in 3 GeV Au+Au collisions at RHIC,https://drupal.star.bnl.gov/STAR/publications/disappearance-partonic-collectivity-3-gev-auau-collisions-rhic,PLB 2022,PLB,2022,Phys. Lett. B 827 (2022) 137003,published,https://doi.org/10.1016/j.physletb.2022.137003,Phys. Lett. B server,https://www.hepdata.net/record/ins1897294,2108.00908,http://arxiv.org/abs/2108.00908,,
310,"Probing Strangeness Canonical Ensemble with K-, phi(1020) and Xi- Production in Au+Au Collisions at sqrt{s_NN} = 3 GeV",https://drupal.star.bnl.gov/STAR/publications/probing-strangeness-canonical-ensemble-k-phi1020-and-xi-production-auau-collisions-sqrt,PLB 2022,PLB,2022,Phys. Lett. B 831 (2022) 137152,published,https://doi.org/10.1016/j.physletb.2022.137152,Phys. Lett. B server,https://www.hepdata.net/record/ins1897327,2108.00924,http://arxiv.org/abs/2108.00924,,
308,Search for the Chiral Magnetic Effect in Au+Au collisions at sqrt{sNN} = 27 GeV with the STAR forward Event Plane Detectors,https://drupal.star.bnl.gov/STAR/publications/Search-Chiral-Magnetic-Effect-AuAu-collisions-sqrtsNN-27-GeV-STAR-forward-Event-Plane-D,PLB 2023,PLB,2023,Phys. Lett. B 839 (2023) 137779,published,https://doi.org/10.1016/j.physletb.2023.137779,Phys. Lett. B server,https://www.hepdata.net/record/ins2148920,2209.03467,http://arxiv.org/abs/2209.03467,,
303,Collision-system and beam-energy dependence of anisotropic flow fluctuations,https://drupal.star.bnl.gov/STAR/publications/Collision-system-and-beam-energy-dependence-anisotropic-flow-fluctuations,PRL 2022,PRL,2022,Phys. Rev. Lett. 129 (2022) 252301,published,https://doi.org/10.1103/PhysRevLett.129.252301,Phys. Rev. Lett. server,,2201.10365,http://arxiv.org/abs/2201.10365,,
298,Observation of Global Spin Alignment of phi and K*0 Vector Mesons in Nuclear Collisions,https://drupal.star.bnl.gov/STAR/publications/Observation-Global-Spin-Alignment-phi-and-K0-Vector-Mesons-Nuclear-Collisions,Nature 2023,Nature,2023,Nature 614 (2023) 244,published,https://doi.org/10.1038/s41586-022-05557-5,Nature server,https://www.hepdata.net/record/ins2063245,2204.02302,http://arxiv.org/abs/2204.02302,,
293,Beam-energy dependence of the directed flow of deuterons in Au+Au collisions,https://drupal.star.bnl.gov/STAR/publications/beam-energy-dependence-directed-flow-deuterons-auau-collisions,PRC 2020,PRC,2020,Phys. Rev. C 102 (2020) 44906,published,http://link.aps.org/abstract/PRC/V102/P044906,Phys. Rev. C server,https://www.hepdata.net/record/ins1806121,2007.04609,http://arxiv.org/abs/2007.04609,,
287,"Measurement of the Sixth-Order Cumulant of Net-Proton Multiplicity Distributions in Au+Au Collisions at sqrt{sNN} = 27 , 54.4, and 200 GeV at RHIC",https://drupal.star.bnl.gov/STAR/publications/measurement-sixth-order-cumulant-net-proton-multiplicity-distributions-27-544-and-200-g,PRL 2021,PRL,2021,Phys. Rev. Lett. 127 (2021) 262301,published,https://link.aps.org/doi/10.1103/PhysRevLett.127.262301,Phys. Rev. Lett. server,https://www.hepdata.net/record/ins1866196,2105.14698,http://arxiv.org/abs/2105.14698,,
285,"Cumulants and correlation functions of net-proton, proton, and antiproton multiplicity distributions in Au+Au collisions at energies available at the BNL Relativistic Heavy Ion Collider",https://drupal.star.bnl.gov/STAR/publications/cumulants-and-correlation-functions-net-proton-proton-and-antiproton-multiplicity-distr,PRC 2021,PRC,2021,Phys. Rev. C 104 (2021) 24902,published,http://link.aps.org/abstract/PRC/V104/P024902,Phys. Rev. C server,https://www.hepdata.net/record/ins1843941,2101.12413,http://arxiv.org/abs/2101.12413,,
284,Nonmonotonic Energy Dependence of Net-Proton Number Fluctuations,https://drupal.star.bnl.gov/STAR/publications/nonmonotonic-energy-dependence-net-proton-number-fluctuations,PRL 2021,PRL,2021,Phys. Rev. Lett. 126 (2021) 92301,published,http://link.aps.org/abstract/PRL/V126/P092301,Phys. Rev. Lett. server,https://www.hepdata.net/record/ins1774673,2001.02852,http://arxiv.org/abs/2001.02852,,
273,Flow and interferometry results from Au+Au collisions at sqrt{sNN} = 4.5 GeV,https://drupal.star.bnl.gov/STAR/publications/flow-and-interferometry-results-auau-collisions-sqrtsnn-45-gev,PRC 2021,PRC,2021,Phys. Rev. C 103 (2021) 34908,published,http://link.aps.org/abstract/PRC/V103/P034908,Phys. Rev. C server,https://www.hepdata.net/record/ins1809043,2007.14005,http://arxiv.org/abs/2007.14005,,
272,Beam energy dependence of net-Lambda fluctuations measured by the STAR experiment at the BNL Relativistic Heavy Ion Collider,https://drupal.star.bnl.gov/STAR/publications/beam-energy-dependence-net-lambda-fluctuations-measured-star-experiment-bnl-relativisti,PRC 2020,PRC,2020,Phys. Rev. C 102 (2020) 24903,published,http://link.aps.org/abstract/PRC/V102/P024903,Phys. Rev. C server,https://www.hepdata.net/record/ins1776194,2001.06419,http://arxiv.org/abs/2001.06419,,
265,Beam-energy dependence of identified two-particle angular correlations in Au+Au collisions at RHIC,https://drupal.star.bnl.gov/STAR/publications/beam-energy-dependence-identified-two-particle-angular-correlations-auau-collisions-rhi,PRC 2020,PRC,2020,Phys. Rev. C 101 (2020) 14916,published,http://link.aps.org/abstract/PRC/V101/P014916,Phys. Rev. C server,https://www.hepdata.net/record/ins1740846,1906.09204,http://arxiv.org/abs/1906.09204,,
264,Beam energy dependence of (anti-)deuteron production in Au+Au collisions at RHIC,https://drupal.star.bnl.gov/STAR/publications/beam-energy-dependence-anti-deuteron-production-auau-collisions-rhic,PRC 2019,PRC,2019,Phys. Rev. C 99 (2019) 64905,published,http://link.aps.org/abstract/PRC/V99/P064905,Phys. Rev. C server,https://www.hepdata.net/record/ins1727273,1903.11778,http://arxiv.org/abs/1903.11778,,
263,"Collision energy dependence of second-order off-diagonal and diagonal cumulants of net-charge, net-proton and net-kaon multiplicity distributions in Au+Au collisions",https://drupal.star.bnl.gov/STAR/publications/collision-energy-dependence-second-order-diagonal-and-diagonal-cumulants-net-charge-net,PRC 2019,PRC,2019,Phys. Rev. C 100 (2019) 14902,published,http://link.aps.org/abstract/PRC/V100/P014902,Phys. Rev. C server,https://www.hepdata.net/record/ins1724809,1903.05370,http://arxiv.org/abs/1903.05370,,
261,Bulk Properties of the System Formed in Au+Au Collisions at sqrt(sNN) = 14.5 GeV,https://drupal.star.bnl.gov/STAR/publications/bulk-properties-system-formed-auau-collisions-sqrtsnn-145-gev,PRC 2020,PRC,2020,Phys. Rev. C 101 (2020) 24905,published,http://link.aps.org/abstract/PRC/V101/P024905,Phys. Rev. C server,https://www.hepdata.net/record/ins1748776,1908.03585,http://arxiv.org/abs/1908.03585,,
257,Collision-energy Dependence of pt Correlations in Au + Au collisions at energies available at the BNL Relativistic Heavy Ion Collider,https://drupal.star.bnl.gov/STAR/publications/collision-energy-dependence-pt-correlations-auau-collisions-rhic,PRC 2019,PRC,2019,Phys. Rev. C 99 (2019) 44918,published,http://link.aps.org/abstract/PRC/V99/P044918,Phys. Rev. C server,https://www.hepdata.net/record/ins1712047,1901.00837,http://arxiv.org/abs/1901.00837,,
256,Search for the chiral magnetic wave using anisotropic flow of identified particles at RHIC,https://drupal.star.bnl.gov/STAR/publications/Search-chiral-magnetic-wave-using-anisotropic-flow-identified-particles-RHIC,PRC 2023,PRC,2023,Phys. Rev. C 108 (2023) 14908,published,https://doi.org/10.1103/PhysRevC.108.014908,Phys. Rev. C server,,2210.14027,http://arxiv.org/abs/2210.14027,,
241,Beam Energy Dependence of Rapidity-Even Dipolar Flow in Au+Au Collisions,https://drupal.star.bnl.gov/STAR/publications/beam-energy-dependence-rapidity-even-dipolar-flow-auau-collisions,PLB 2018,PLB,2018,Phys. Lett. B 784 (2018) 26,published,http://dx.doi.org/10.1016/j.physletb.2018.07.013,Phys. Lett. B server,https://www.hepdata.net/record/ins1669807,1804.08647,http://arxiv.org/abs/1804.08647,,
237,"Strange hadron production in Au+Au collisions at sqrt(sNN)=7.7, 11.5, 19.6, 27, and 39 GeV",https://drupal.star.bnl.gov/STAR/publications/strange-hadron-production-auau-collisions-sqrtsnn-77-115-196-27-and-39-gev,PRC 2020,PRC,2020,Phys. Rev. C 102 (2020) 34909,published,http://link.aps.org/abstract/PRC/V102/P034909,Phys. Rev. C server,https://www.hepdata.net/record/ins1738953,1906.03732,http://arxiv.org/abs/1906.03732,,
233,"Beam-Energy Dependence of Directed Flow of Lambda, Anti-Lambda, K plus, K minus, K0 short and phi in Au+Au Collisions",https://drupal.star.bnl.gov/STAR/publications/beam-energy-dependence-directed-flow-lambda-anti-lambda-k-plus-k-minus-k0-short-and-phi,PRL 2018,PRL,2018,Phys. Rev. Lett. 120 (2018) 62301,published,http://link.aps.org/abstract/PRL/V120/P062301,Phys. Rev. Lett. server,https://www.hepdata.net/record/ins1618747,1708.07132,http://arxiv.org/abs/1708.07132,,
232,Collision energy dependence of moments of net-kaon multiplicity distributions at RHIC,https://drupal.star.bnl.gov/STAR/publications/collision-energy-dependence-moments-net-kaon-multiplicity-distributions-rhic,PLB 2018,PLB,2018,Phys. Lett. B 785 (2018) 551,published,http://dx.doi.org/10.1016/j.physletb.2018.07.066,Phys. Lett. B server,https://www.hepdata.net/record/ins1621460,1709.00773,http://arxiv.org/abs/1709.00773,,
230,"Beam Energy Dependence of Jet-Quenching Effects in Au+Au Collisions at sqrt(sNN) = 7.7, 11.5, 14.5, 19.6, 27, 39, and 62.4 GeV",https://drupal.star.bnl.gov/STAR/publications/beam-energy-dependence-jet-quenching-effects-auau-collisions-sqrtsnn-77-115-145-196-27-,PRL 2018,PRL,2018,Phys. Rev. Lett. 121 (2018) 32301,published,http://link.aps.org/abstract/PRL/V121/P032301,Phys. Rev. Lett. server,https://www.hepdata.net/record/ins1609067,1707.01988,http://arxiv.org/abs/1707.01988,,
228,Global Λ hyperon polarization in nuclear collisions: evidence for the most vortical fluid,https://drupal.star.bnl.gov/STAR/publications/global-lambda-hyperon-polarization-nuclear-collisions-evidence-most-vortical-fluid,Nature 2017,Nature,2017,Nature 548 (2017) 62,published,http://www.nature.com/nature/journal/v548/n7665/full/nature23004.html,Nature server,https://www.hepdata.net/record/ins1510474,1701.06657,http://arxiv.org/abs/1701.06657,,
227,"Measurements of Dielectron Production in Au+Au Collisions at sqrt(sNN)= 27, 39, and 62.4 GeV from the STAR Experiment",https://drupal.star.bnl.gov/STAR/publications/measurements-dielectron-production-auau-collisions-sqrtsnn-27-39-and-624-gev-star-exper,PRC 2023,PRC,2023,Phys. Rev. C 107 (2023) 0,published,https://journals.aps.org/prc/abstract/10.1103/PhysRevC.107.L061901,Phys. Rev. C server,https://www.hepdata.net/record/ins1700232,1810.10159,http://arxiv.org/abs/1810.10159,,
218,"Energy dependence of J/psi production in Au+Au collisions at sqrt(sNN)=39, 62.4 and 200GeV",https://drupal.star.bnl.gov/STAR/publications/energy-dependence-jpsi-production-auau-collisions-sqrtsnn-39-624-and-200-gev,PLB 2017,PLB,2017,Phys. Lett. B 771 (2017) 13,published,http://dx.doi.org/10.1016/j.physletb.2017.04.078,Phys. Lett. B server,https://www.hepdata.net/record/ins1478040,1607.07517,http://arxiv.org/abs/1607.07517,,
213,Beam Energy Dependence of the Third Harmonic of Azimuthal Correlations in Au+Au Collisions at RHIC,https://drupal.star.bnl.gov/STAR/publications/beam-energy-dependence-third-harmonic-azimuthal-correlations-auau-collisions-rhic,PRL 2016,PRL,2016,Phys. Rev. Lett. 116 (2016) 112302,published,http://link.aps.org/abstract/PRL/V116/P112302,Phys. Rev. Lett. server,https://www.hepdata.net/record/ins1414638,1601.01999,http://arxiv.org/abs/1601.01999,,
212,Centrality dependence of identified particle elliptic flow in relativistic heavy ion collisions at sqrt(sNN)= 7.7-62.4 GeV,https://drupal.star.bnl.gov/STAR/publications/centrality-dependence-identified-particle-elliptic-flow-relativistic-heavy-ion-collisio,PRC 2016,PRC,2016,Phys. Rev. C 93 (2016) 14907,published,http://link.aps.org/abstract/PRC/V93/P014907,Phys. Rev. C server,https://www.hepdata.net/record/ins1395151,1509.08397,http://arxiv.org/abs/1509.08397,,
208,"Measurement of elliptic flow of light nuclei at sqrt(sNN) = 200, 62.4, 39, 27, 19.6, 11.5, and 7.7 GeV at RHIC",https://drupal.star.bnl.gov/STAR/publications/measurement-elliptic-flow-light-nuclei-sqrtsnn-200-624-39-27-196-115-and-77-gev-rhic,PRC 2016,PRC,2016,Phys. Rev. C 94 (2016) 34908,published,http://link.aps.org/abstract/PRC/V94/P034908,Phys. Rev. C server,https://www.hepdata.net/record/ins1416992,1601.07052,http://arxiv.org/abs/1601.07052,,
207,Bulk Properties of the Medium Produced in Relativistic Heavy-Ion Collisions from the Beam Energy Scan Program,https://drupal.star.bnl.gov/STAR/publications/bulk-properties-medium-produced-relativistic-heavy-ion-collisions-beam-energy-scan-prog,PRC 2017,PRC,2017,Phys. Rev. C 96 (2017) 44904,published,http://link.aps.org/abstract/PRC/V96/P044904,Phys. Rev. C server,https://www.hepdata.net/record/ins1510593,1701.07065,http://arxiv.org/abs/1701.07065,,
